{
  "schema_version": 1,
  "sources": [
    {
      "source_key": "drivewise-synthetic-catalog",
      "name": "Drivewise Synthetic Catalog Fixture",
      "source_type": "manual_seed",
      "market": "IT",
      "ranking_permission": "permitted",
      "url": "https://example.test/drivewise/catalog",
      "license": "Synthetic test data; no external rights asserted",
      "notes": "Fictional catalog fixture. All observations use 2026-07-16T09:00:00+02:00 so coverage tests can pin evaluation time."
    },
    {
      "source_key": "drivewise-synthetic-review-only",
      "name": "Drivewise Synthetic Review-only Fixture",
      "source_type": "manual_seed",
      "market": "IT",
      "ranking_permission": "not_permitted",
      "url": "https://example.test/drivewise/review-only",
      "license": "Synthetic test data; ranking deliberately prohibited",
      "notes": "Exercises the source_not_permitted exclusion."
    }
  ],
  "vehicles": [
    {"canonical_key":"it-acme-metro-2026","model_family_key":"it-acme-metro","make":"Acme","model":"Metro","model_year":2026,"market":"IT","source_key":"drivewise-synthetic-catalog","source_url":"https://example.test/catalog/acme-metro","observed_at":"2026-07-16T09:00:00+02:00"},
    {"canonical_key":"it-acme-glide-2026","model_family_key":"it-acme-glide","make":"Acme","model":"Glide","model_year":2026,"market":"IT","source_key":"drivewise-synthetic-catalog","source_url":"https://example.test/catalog/acme-glide","observed_at":"2026-07-16T09:00:00+02:00"},
    {"canonical_key":"it-novus-trail-2026","model_family_key":"it-novus-trail","make":"Novus","model":"Trail","model_year":2026,"market":"IT","source_key":"drivewise-synthetic-catalog","source_url":"https://example.test/catalog/novus-trail","observed_at":"2026-07-16T09:00:00+02:00"},
    {"canonical_key":"it-novus-sprint-2024","model_family_key":"it-novus-sprint","make":"Novus","model":"Sprint","model_year":2024,"market":"IT","source_key":"drivewise-synthetic-catalog","source_url":"https://example.test/catalog/novus-sprint","observed_at":"2026-07-16T09:00:00+02:00"},
    {"canonical_key":"it-brava-tour-2024","model_family_key":"it-brava-tour","make":"Brava","model":"Tour","model_year":2024,"market":"IT","source_key":"drivewise-synthetic-catalog","source_url":"https://example.test/catalog/brava-tour","observed_at":"2026-07-16T09:00:00+02:00"},
    {"canonical_key":"it-brava-crest-2023","model_family_key":"it-brava-crest","make":"Brava","model":"Crest","model_year":2023,"market":"IT","source_key":"drivewise-synthetic-catalog","source_url":"https://example.test/catalog/brava-crest","observed_at":"2026-07-16T09:00:00+02:00"},
    {"canonical_key":"it-orion-haven-2026","model_family_key":"it-orion-haven","make":"Orion","model":"Haven","model_year":2026,"market":"IT","source_key":"drivewise-synthetic-catalog","source_url":"https://example.test/catalog/orion-haven","observed_at":"2026-07-16T09:00:00+02:00"},
    {"canonical_key":"it-orion-haul-2023","model_family_key":"it-orion-haul","make":"Orion","model":"Haul","model_year":2023,"market":"IT","source_key":"drivewise-synthetic-catalog","source_url":"https://example.test/catalog/orion-haul","observed_at":"2026-07-16T09:00:00+02:00"},
    {"canonical_key":"it-vento-summit-2024","model_family_key":"it-vento-summit","make":"Vento","model":"Summit","model_year":2024,"market":"IT","source_key":"drivewise-synthetic-catalog","source_url":"https://example.test/catalog/vento-summit","observed_at":"2026-07-16T09:00:00+02:00"},
    {"canonical_key":"it-vento-pico-2022","model_family_key":"it-vento-pico","make":"Vento","model":"Pico","model_year":2022,"market":"IT","source_key":"drivewise-synthetic-catalog","source_url":"https://example.test/catalog/vento-pico","observed_at":"2026-07-16T09:00:00+02:00"},
    {"canonical_key":"it-lumen-compact-2023","model_family_key":"it-lumen-compact","make":"Lumen","model":"Compact","model_year":2023,"market":"IT","source_key":"drivewise-synthetic-catalog","source_url":"https://example.test/catalog/lumen-compact","observed_at":"2026-07-16T09:00:00+02:00"},
    {"canonical_key":"it-lumen-road-2026","model_family_key":"it-lumen-road","make":"Lumen","model":"Road","model_year":2026,"market":"IT","source_key":"drivewise-synthetic-catalog","source_url":"https://example.test/catalog/lumen-road","observed_at":"2026-07-16T09:00:00+02:00"},
    {"canonical_key":"it-acme-cross-2023","model_family_key":"it-acme-cross","make":"Acme","model":"Cross","model_year":2023,"market":"IT","source_key":"drivewise-synthetic-catalog","source_url":"https://example.test/catalog/acme-cross","observed_at":"2026-07-16T09:00:00+02:00"},
    {"canonical_key":"it-novus-flow-2023","model_family_key":"it-novus-flow","make":"Novus","model":"Flow","model_year":2023,"market":"IT","source_key":"drivewise-synthetic-catalog","source_url":"https://example.test/catalog/novus-flow","observed_at":"2026-07-16T09:00:00+02:00"},
    {"canonical_key":"it-brava-nest-2022","model_family_key":"it-brava-nest","make":"Brava","model":"Nest","model_year":2022,"market":"IT","source_key":"drivewise-synthetic-catalog","source_url":"https://example.test/catalog/brava-nest","observed_at":"2026-07-16T09:00:00+02:00"},
    {"canonical_key":"it-orion-craft-2026","model_family_key":"it-orion-craft","make":"Orion","model":"Craft","model_year":2026,"market":"IT","source_key":"drivewise-synthetic-catalog","source_url":"https://example.test/catalog/orion-craft","observed_at":"2026-07-16T09:00:00+02:00"},
    {"canonical_key":"it-vento-estate-2026","model_family_key":"it-vento-estate","make":"Vento","model":"Estate","model_year":2026,"market":"IT","source_key":"drivewise-synthetic-catalog","source_url":"https://example.test/catalog/vento-estate","observed_at":"2026-07-16T09:00:00+02:00"},
    {"canonical_key":"it-lumen-ridge-2026","model_family_key":"it-lumen-ridge","make":"Lumen","model":"Ridge","model_year":2026,"market":"IT","source_key":"drivewise-synthetic-catalog","source_url":"https://example.test/catalog/lumen-ridge","observed_at":"2026-07-16T09:00:00+02:00"},
    {"canonical_key":"it-acme-saloon-2023","model_family_key":"it-acme-saloon","make":"Acme","model":"Saloon","model_year":2023,"market":"IT","source_key":"drivewise-synthetic-catalog","source_url":"https://example.test/catalog/acme-saloon","observed_at":"2026-07-16T09:00:00+02:00"},
    {"canonical_key":"it-novus-dot-2023","model_family_key":"it-novus-dot","make":"Novus","model":"Dot","model_year":2023,"market":"IT","source_key":"drivewise-synthetic-catalog","source_url":"https://example.test/catalog/novus-dot","observed_at":"2026-07-16T09:00:00+02:00"},
    {"canonical_key":"it-brava-mini-2022","model_family_key":"it-brava-mini","make":"Brava","model":"Mini","model_year":2022,"market":"IT","source_key":"drivewise-synthetic-catalog","source_url":"https://example.test/catalog/brava-mini","observed_at":"2026-07-16T09:00:00+02:00"},
    {"canonical_key":"it-orion-lift-2023","model_family_key":"it-orion-lift","make":"Orion","model":"Lift","model_year":2023,"market":"IT","source_key":"drivewise-synthetic-catalog","source_url":"https://example.test/catalog/orion-lift","observed_at":"2026-07-16T09:00:00+02:00"},
    {"canonical_key":"it-vento-mover-2023","model_family_key":"it-vento-mover","make":"Vento","model":"Mover","model_year":2023,"market":"IT","source_key":"drivewise-synthetic-catalog","source_url":"https://example.test/catalog/vento-mover","observed_at":"2026-07-16T09:00:00+02:00"},
    {"canonical_key":"it-lumen-grand-2024","model_family_key":"it-lumen-grand","make":"Lumen","model":"Grand","model_year":2024,"market":"IT","source_key":"drivewise-synthetic-catalog","source_url":"https://example.test/catalog/lumen-grand","observed_at":"2026-07-16T09:00:00+02:00"}
  ],
  "variants": [
    {
      "variant_key": "it-acme-metro-2026-petrol",
      "vehicle_key": "it-acme-metro-2026",
      "trim": "City",
      "is_default": true,
      "body_style": "city_car",
      "fuel_type": "petrol",
      "generation_name": "Second generation",
      "restyling_label": "2026 update",
      "category": "city_car",
      "doors": 5,
      "length_mm": 3820,
      "width_mm": 1680,
      "height_mm": 1530,
      "wheelbase_mm": 2440,
      "curb_weight_kg": 1120,
      "gross_weight_kg": 1580,
      "payload_kg": 460,
      "engine": "1.0 turbo petrol",
      "engine_code": "SYN-T10",
      "displacement_cc": 999,
      "cylinders": 3,
      "horsepower": 100,
      "power_kw": 74,
      "torque_nm": 170,
      "transmission": "6-speed manual",
      "transmission_type": "manual",
      "gear_count": 6,
      "drivetrain": "fwd",
      "differential_type": "open",
      "acceleration_0_100_s": 10.8,
      "top_speed_kmh": 185,
      "braking_100_0_m": 36.5,
      "homologation_cycle": "WLTP",
      "consumption_l_100km": 5.1,
      "co2_g_km": 116,
      "euro_emission_standard": "Euro 6e",
      "seats": 5,
      "cargo_volume_liters": 280,
      "maintenance_schedule": [
        {"operation_code": "engine-oil", "title": "Engine oil and filter", "interval_km": 15000, "interval_months": 12, "notes": "Whichever occurs first", "source_key": "drivewise-synthetic-catalog", "source_url": "https://example.test/maintenance/metro-engine-oil", "observed_at": "2026-07-16T09:00:00+02:00"},
        {"operation_code": "brake-fluid", "title": "Brake fluid replacement", "interval_months": 24, "source_key": "drivewise-synthetic-catalog", "source_url": "https://example.test/maintenance/metro-brake-fluid", "observed_at": "2026-07-16T09:00:00+02:00"}
      ],
      "safety_ratings": [
        {"assessment_system": "Synthetic Euro NCAP", "assessment_year": 2026, "overall_stars": 5, "adult_occupant_percent": 88, "child_occupant_percent": 84, "vulnerable_road_users_percent": 72, "safety_assist_percent": 79, "source_key": "drivewise-synthetic-catalog", "source_url": "https://example.test/safety/metro-euro-ncap", "observed_at": "2026-07-16T09:00:00+02:00"}
      ],
      "features": [